{
  "schema_version": "1.0",
  "message_id": "gate-20261020-b:moment:gate-20261020-b:goal:v1:evt-0340",
  "run_id": "gate-20261020-b",
  "type": "moment",
  "state_version": 340,
  "sent_at": "2026-10-20T02:44:11.600Z",
  "payload": {
    "moment_id": "gate-20261020-b:goal:v1:evt-0340",
    "rule": "goal",
    "priority": 3,
    "period": 1,
    "match_time_ms": 1457423,
    "source_sequence": 340
  }
}
