{
  "schema_version": "1.0",
  "message_id": "gate-20261020-b:insight:gate-20261020-b:goal:v1:evt-0340",
  "run_id": "gate-20261020-b",
  "type": "insight",
  "state_version": 400,
  "sent_at": "2026-10-20T02:45:37.373Z",
  "payload": {
    "schema_version": "1.1",
    "run_id": "gate-20261020-b",
    "match_id": "harbor-vale",
    "moment_id": "gate-20261020-b:goal:v1:evt-0340",
    "headline": "Goal for Vale Owls",
    "casual_text": "Remy Lachance scores from 10.6 m. It is now Harbor Comets 0, Vale Owls 1.",
    "analyst_text": "Goal at 25': shot from 10.6 m, ending a possession with 3 recorded actions. Score 0-1.",
    "language": "en",
    "evidence_ids": [
      "evt-0338",
      "evt-0339",
      "evt-0340"
    ],
    "metrics": [
      {
        "name": "shot_distance",
        "value": 10.6,
        "unit": "m"
      },
      {
        "name": "possession_actions",
        "value": 3,
        "unit": "events"
      }
    ],
    "limitations": [
      "Synthetic match data generated by a seeded simulator.",
      "Event locations only; no player tracking or off-ball positions are available.",
      "AI narration is not connected; this text is a deterministic template from verified metrics."
    ],
    "generation_mode": "fallback",
    "knowledge_source_ids": [
      "goal-v1"
    ]
  }
}
